{"definitions":[],"foundation":"bf5dbfb96d6d50124d109c35804c81e5a27bf4038b7f65b1a909ad4f0cc13fa3","program":{"dependencies":{},"identity":"b105b3e9bb839e7353a970c51c5088ce2ac4d2ebc42627799aaafd336d8ccc57","name":"pilot_E05","order":["a","version","b","count","complete"],"params":[],"result":{"ref":"b"},"result_type":"Int64","revision":1,"steps":[{"deps":[],"id":"a","node":{"codec":"uint8","op":"atom"},"type":"Int64"},{"deps":["a"],"id":"version","node":{"code":"VERSION","op":"check","site":{"ref":"a"},"test":{"eq":[{"ref":"a"},{"const":7}]}},"type":"Unit"},{"deps":[],"id":"b","node":{"codec":"uint8","op":"atom"},"type":"Int64"},{"deps":["b"],"id":"count","node":{"code":"COUNT","op":"check","site":{"ref":"b"},"test":{"le":[{"ref":"b"},{"const":12}]}},"type":"Unit"},{"deps":[],"id":"complete","node":{"op":"end"},"type":"Unit"}]},"version":"typed-composition-1"}
