{"definitions":[],"foundation":"bf5dbfb96d6d50124d109c35804c81e5a27bf4038b7f65b1a909ad4f0cc13fa3","program":{"dependencies":{},"identity":"bf89009901e9d1c8f7a118a9587ea04dc8f8da53954b59dce967cf44d28b62c7","name":"pilot_E03","order":["a","flag_a","b","flag_b","same","agreement","complete"],"params":[],"result":{"ref":"a"},"result_type":"Int64","revision":1,"steps":[{"deps":[],"id":"a","node":{"codec":"uint8","op":"atom"},"type":"Int64"},{"deps":["a"],"id":"flag_a","node":{"code":"FLAG_A","op":"check","site":{"ref":"a"},"test":{"le":[{"ref":"a"},{"const":1}]}},"type":"Unit"},{"deps":[],"id":"b","node":{"codec":"uint8","op":"atom"},"type":"Int64"},{"deps":["b"],"id":"flag_b","node":{"code":"FLAG_B","op":"check","site":{"ref":"b"},"test":{"le":[{"ref":"b"},{"const":1}]}},"type":"Unit"},{"deps":["a","b"],"id":"same","node":{"expr":{"eq":[{"ref":"a"},{"ref":"b"}]},"op":"value"},"type":"Bool"},{"deps":["same","a"],"id":"agreement","node":{"code":"DISAGREE","op":"check","site":{"ref":"a"},"test":{"eq":[{"ref":"same"},{"const":true}]}},"type":"Unit"},{"deps":[],"id":"complete","node":{"op":"end"},"type":"Unit"}]},"version":"typed-composition-1"}
